{
  "name": "calculate",
  "description": "Use when the user wants to perform arithmetic calculations. Keywords: calculate, compute, add, subtract, multiply, divide, +, -, *, /",
  "vibe_test_phrases": [
    "calculate 5 + 3",
    "what's 10 * 7?",
    "compute 100 / 4",
    "15 - 8 equals what?",
    "multiply 12 by 9",
    "what is 2 plus 2?"
  ],
  "parameters": {
    "expression": {
      "type": "string",
      "description": "The mathematical expression to evaluate (e.g., '5 + 3', '10 * 2')",
      "required": true
    }
  },
  "function_code": "\ndef execute(expression: str = None):\n    if not expression:\n        log(\"[Calculator] Error: No expression provided for calculation\")\n        return\n    \n    log(f\"[Calculator] Evaluating expression: {expression}\")\n    \n    try:\n        expression = expression.strip()\n        log(f\"[Calculator] Cleaned expression: {expression}\")\n        \n        allowed_chars = \"0123456789+-*/.()\"\n        if not all(c in allowed_chars or c.isspace() for c in expression):\n            log(f\"[Calculator] Error: Expression contains invalid characters\")\n            log(f\"[Calculator] Only numbers and operators (+, -, *, /, parentheses) are allowed\")\n            return\n        \n        result = eval(expression)\n        \n        if isinstance(result, float) and result.is_integer():\n            result = int(result)\n        \n        log(f\"[Calculator] Result: {expression} = {result}\")\n        \n        if '+' in expression:\n            log(\"[Calculator] Operation type: Addition\")\n        if '-' in expression:\n            log(\"[Calculator] Operation type: Subtraction\")\n        if '*' in expression:\n            log(\"[Calculator] Operation type: Multiplication\")\n        if '/' in expression:\n            log(\"[Calculator] Operation type: Division\")\n            if result != 0 and '/' in expression:\n                parts = expression.split('/')\n                if len(parts) == 2:\n                    try:\n                        dividend = float(eval(parts[0]))\n                        divisor = float(eval(parts[1]))\n                        if dividend % divisor != 0:\n                            log(f\"[Calculator] Note: Result includes decimal portion\")\n                    except:\n                        pass\n        \n    except ZeroDivisionError:\n        log(\"[Calculator] Error: Division by zero!\")\n        log(\"[Calculator] Mathematical note: Division by zero is undefined\")\n    except Exception as e:\n        log(f\"[Calculator] Error evaluating expression: {str(e)}\")\n        log(\"[Calculator] Please check your expression format\")\n",
  "verified": true,
  "scope": "global",
  "role": "mathematics",
  "created_at": "2025-08-30T10:28:14.101883",
  "last_modified": "2025-08-30T10:28:14.101886",
  "execution_count": 0,
  "success_rate": 100.0,
  "average_execution_time": 0.0,
  "tags": []
}